{
  "pattern_id": "PP-0005",
  "name": "Flask session cookie disclosure (CVE-2023-30861)",
  "description": "Flask before 2.3.2 may disclose cached session cookies under certain proxy configurations.",
  "weakness_class": "CWE-200",
  "match": {
    "cve_ids": ["CVE-2023-30861"],
    "package": "flask",
    "ecosystem": "pypi",
    "version_below": "2.3.2"
  },
  "controls": {
    "nist_800_53_rev5": ["AC-4", "SC-4", "AC-12"],
    "cis_controls_v8": ["3.3", "6.5"],
    "pci_dss_4_0": ["8.2.8", "8.3.6", "10.4.2"],
    "iso_27001_2022": ["A.8.3", "A.5.17"],
    "owasp_asvs_v4": ["3.4.1", "3.4.2"]
  },
  "rationale": "Session fixation / disclosure breaks NIST SC-4 (information in shared resources) and AC-12 (session termination). PCI DSS 8.2.8 and 8.3.6 require authenticated session protection.",
  "remediation_priority": "high",
  "references": [
    "https://nvd.nist.gov/vuln/detail/CVE-2023-30861"
  ]
}
