{
  "pattern_id": "PP-0007",
  "name": "OpenSSL in container base image below 3.0.13",
  "description": "Container OS-level OpenSSL before 3.0.13 is subject to multiple CVEs including x509 name constraint handling issues.",
  "weakness_class": "CWE-295",
  "match": {
    "package": "openssl",
    "ecosystem": "os",
    "version_below": "3.0.13"
  },
  "controls": {
    "nist_800_53_rev5": ["SC-8", "SC-12", "SC-13", "SC-17", "SI-2"],
    "cis_controls_v8": ["3.10", "7.3"],
    "pci_dss_4_0": ["4.2.1", "4.2.2", "6.3.3"],
    "iso_27001_2022": ["A.8.24", "A.8.28"]
  },
  "rationale": "Base-image cryptographic libraries affect every workload running on the image. NIST SC-17 covers public key infrastructure certificates; SC-12 covers key establishment. PCI DSS 4.2.2 requires trusted certificate chains.",
  "remediation_priority": "high",
  "references": [
    "https://www.openssl.org/news/vulnerabilities.html"
  ]
}
